{"id":"governance-at-scale","title":"Govern GitHub Copilot at Scale","description":"A governance-at-scale briefing connecting GitHub policy, Copilot, GHAS, live demo transitions, and measurable operating practices.","brand":"github","theme":"copilot-dark","audience":"executives, platform, security, and engineering leaders","durationMinutes":55,"status":"active","default":false,"sources":"sources.md","learningObjectives":["Explain how enterprise, organization, repository, team, and identity boundaries fit together.","Assign ownership and decision rights for policy, repositories, teams, and exceptions.","Choose Copilot enablement tiers with data, permission, review, and evidence guardrails.","Connect rulesets and GHAS signals to a measurable SDLC operating model."]}
